{
  "schema_version": "1.0",
  "task_id": "WG-TASK-0001",
  "role": "workers_qa",
  "overall_verdict": "PASS",
  "criteria_results": [
    {
      "acceptance_criterion_id": "AC-001",
      "method": "獨立執行 Repository acceptance command。",
      "expected_result": "exit code 0，沒有 failed 或 skipped test。",
      "actual_result": "exit code 0，1 passed，0 failed，0 skipped。",
      "evidence": [".workers-group/evidence/WG-AC-001-qa.txt"],
      "verdict": "PASS",
      "severity": "NONE",
      "reproduction_steps": ["執行 acceptance command。"],
      "regression_risk": "LOW",
      "recommended_action": "進入 READY_FOR_BOSS_REVIEW。",
      "memory_validation_result": "NOT_APPLICABLE"
    }
  ],
  "design_findings": [],
  "regression_findings": [],
  "unverified_items": [],
  "memory_findings": [],
  "evidence": [".workers-group/evidence/WG-AC-001-qa.txt"],
  "timestamp": "2026-07-30T00:00:00+08:00"
}
